{
  "schema": "rvas.s9.control-plane-registry.v1",
  "capturedUtc": "2026-07-15T00:00:00Z",
  "agents": [
    {
      "registryId": "agent-001",
      "displayName": "Benefits Answer Bot",
      "identityObjectId": "11111111-1111-1111-1111-111111111111",
      "executionMode": "agent_identity",
      "managed": true,
      "lifecycleState": "active",
      "accountableOwner": "people-operations",
      "technicalOwner": "service-platform",
      "lifecycleReviewRef": "record://lifecycle/agent-001",
      "materialChangeReviewStatus": "not_applicable",
      "materialChangeReviewRef": null,
      "lifecycleTransition": null,
      "closureOwner": null,
      "closureReviewRef": null
    },
    {
      "registryId": "agent-002",
      "displayName": "Research Assistant",
      "identityObjectId": "22222222-2222-2222-2222-222222222222",
      "executionMode": "user_delegated",
      "managed": false,
      "lifecycleState": "exception",
      "accountableOwner": "research-operations",
      "technicalOwner": "service-platform",
      "lifecycleReviewRef": "record://lifecycle/agent-002",
      "materialChangeReviewStatus": "pending_review",
      "materialChangeReviewRef": null,
      "lifecycleTransition": null,
      "closureOwner": null,
      "closureReviewRef": null
    },
    {
      "registryId": "agent-003",
      "displayName": "Legacy Knowledge Agent",
      "identityObjectId": null,
      "executionMode": "user_delegated",
      "managed": false,
      "lifecycleState": "retired",
      "accountableOwner": "knowledge-operations",
      "technicalOwner": null,
      "lifecycleReviewRef": "record://lifecycle/agent-003",
      "materialChangeReviewStatus": "reviewed",
      "materialChangeReviewRef": "record://change/agent-003",
      "lifecycleTransition": {
        "fromState": "active",
        "toState": "retired",
        "decisionOwner": "knowledge-operations",
        "reviewRef": "record://transition/agent-003"
      },
      "closureOwner": "knowledge-operations",
      "closureReviewRef": null
    }
  ],
  "tools": [
    {
      "toolId": "tool-001",
      "displayName": "Benefits Knowledge Lookup",
      "parentRegistryId": "agent-001",
      "owner": "service-platform",
      "lifecycleState": "active",
      "lifecycleReviewRef": "record://lifecycle/tool-001",
      "materialChangeReviewStatus": "not_applicable",
      "materialChangeReviewRef": null,
      "lifecycleTransition": null,
      "closureOwner": null,
      "closureReviewRef": null
    },
    {
      "toolId": "tool-002",
      "displayName": "Archived Knowledge Lookup",
      "parentRegistryId": "agent-003",
      "owner": null,
      "lifecycleState": "retired",
      "lifecycleReviewRef": "record://lifecycle/tool-002",
      "materialChangeReviewStatus": "reviewed",
      "materialChangeReviewRef": "record://change/tool-002",
      "lifecycleTransition": null,
      "closureOwner": "knowledge-operations",
      "closureReviewRef": "record://closure/tool-002"
    }
  ]
}
